{
  "schema_version": "2.0.0",
  "person_id": "isabah:9767:7610-2907",
  "book": {
    "slug": "isabah",
    "book_id": 9767
  },
  "entry": {
    "number": 7610,
    "number_is_ambiguous": false,
    "start_id": 2907,
    "end_id": 2908,
    "volume": "5",
    "page_start": 524,
    "page_end": 525,
    "char_len": 1619
  },
  "identity": {
    "display_name": "مالك بن أوس",
    "display_name_norm": "مالك بن اوس",
    "kunya": null,
    "is_woman": false,
    "nasab": {
      "ism": "مالك",
      "father": "أوس",
      "grandfather": "عبد اللَّه",
      "great_grandfather": "حجر",
      "chain": [
        "مالك",
        "أوس",
        "عبد اللَّه",
        "حجر"
      ],
      "links": [
        "بن",
        "بن",
        "بن"
      ],
      "nisba": [
        "الأسلمي"
      ],
      "full_name": "مالك بن أوس بن عبد اللَّه بن حجر الأسلمي",
      "full_name_norm": "مالك بن اوس بن عبد الله بن حجر الاسلمي",
      "source": "heading",
      "confidence": 0.86,
      "rejected_reason": null,
      "link_count": 3
    },
    "alternate_names": [],
    "name_dispute_notes": []
  },
  "classification": {
    "qism": 1,
    "qism_label": "الأول — من ثبتت صحبته برواية أو غيرها",
    "qism_heading": "القسم الأول",
    "section_type": "names",
    "letter": "حرف الميم",
    "bab": "الميم بعدها الألف",
    "volume_toc": "المجلد الخامس",
    "toc_heading": "7610- مالك بن أوس",
    "toc_path": [
      "المجلد الخامس",
      "حرف الميم",
      "القسم الأول",
      "الميم بعدها الألف",
      "ذكر من اسمه مالك",
      "7610- مالك بن أوس"
    ]
  },
  "life": {
    "summary": {
      "value": "7610- مالك بن أوس بن عبد اللَّه بن حجر الأسلمي.",
      "source": "regex",
      "evidence": "7610- مالك بن أوس بن عبد اللَّه بن حجر الأسلمي.",
      "confidence": 0.3
    },
    "birth": {
      "year_hijri": null,
      "year_candidates": [],
      "year_uncertain": false,
      "place": null,
      "place_key": null,
      "cause": null,
      "notes": []
    },
    "death": {
      "year_hijri": null,
      "year_candidates": [],
      "year_uncertain": false,
      "place": null,
      "place_key": null,
      "cause": null,
      "notes": []
    },
    "conversion": [
      {
        "value": "7610- مالك بن أوس بن عبد اللَّه بن حجر الأسلمي.",
        "source": "regex",
        "evidence": "7610- مالك بن أوس بن عبد اللَّه بن حجر الأسلمي.",
        "confidence": 0.3
      },
      {
        "value": "أخرج حديثه أبو نعيم من تاريخ أبي العباس السّراج، من طريق عبد اللَّه بن يسار، حدثنا ياسر بن عبد اللَّه بن مالك بن أوس الأسلمي، عن أبيه، قال: لما هاجر النبيّ صلّى اللَّه عليه وآله وسلم وأبو بكر مرّوا بإبل لنا بالجحفة، فقال: لمن هذه الإبل، قيل: لرجل من أسلم، فالتفت إلى أبي بكر رضي اللَّه عنه فقال: سلمت",
        "source": "regex",
        "evidence": "أخرج حديثه أبو نعيم من تاريخ أبي العباس السّراج، من طريق عبد اللَّه بن يسار، حدثنا ياسر بن عبد اللَّه بن مالك بن أوس الأسلمي، عن أبيه، قال: لما هاجر النبيّ صلّى اللَّه عليه وآله وسلم وأبو بكر مرّوا بإبل لنا بالجحفة، فقال: لمن هذه الإبل، قيل: لرجل من أسلم، فالتفت إلى أبي بكر رضي اللَّه عنه فقال: سلمت إن شاء اللَّه تعالى فأتاه أبي فحمله على جمل ...",
        "confidence": 0.3
      },
      {
        "value": "[وقد مضى في ترجمة أوس بن عبد اللَّه نحو هذا من طريق صخر بن مالك بن إياس بن مالك بن أوس بن عبد اللَّه بن حجر الأسلمي من أهل العرج، أخبره أنّ أباه مالك بن أوس أخبره أنّ أباه أوسا مرّ به، وهو في مغازي موسى بن عقبة، عن ابن شهاب- أن النبيّ صلّى اللَّه تعالى عليه وآله وسلم لما هبط العرج في الهجرة حمله رجل",
        "source": "regex",
        "evidence": "[وقد مضى في ترجمة أوس بن عبد اللَّه نحو هذا من طريق صخر بن مالك بن إياس بن مالك بن أوس بن عبد اللَّه بن حجر الأسلمي من أهل العرج، أخبره أنّ أباه مالك بن أوس أخبره أنّ أباه أوسا مرّ به، وهو في مغازي موسى بن عقبة، عن ابن شهاب- أن النبيّ صلّى اللَّه تعالى عليه وآله وسلم لما هبط العرج في الهجرة حمله رجل من أسلم يقال له مالك بن أوس على جمل يقال له ابن اللقاح، وبعث معه غلاما له يدعى مغيثا، فسلك به.",
        "confidence": 0.3
      },
      {
        "value": "وفي أخبار المدينة للزبير بن بكار، عن محمد بن الحسن بن زبالة، عن صخر بن مالك بن إياس بن كعب بن مالك بن أوس الأسلمي، عن أبيه عن جده- أنّ النبيّ صلّى اللَّه عليه وآله وسلم صلّى بمدلجة تعهن، وبنى بها مسجدا.",
        "source": "regex",
        "evidence": "وفي أخبار المدينة للزبير بن بكار، عن محمد بن الحسن بن زبالة، عن صخر بن مالك بن إياس بن كعب بن مالك بن أوس الأسلمي، عن أبيه عن جده- أنّ النبيّ صلّى اللَّه عليه وآله وسلم صلّى بمدلجة تعهن، وبنى بها مسجدا.",
        "confidence": 0.3
      }
    ],
    "companionship": [
      {
        "value": "له ولأبيه صحبة.",
        "source": "regex",
        "evidence": "له ولأبيه صحبة.",
        "confidence": 0.3
      }
    ],
    "battles": [],
    "offices": [],
    "family": [],
    "residences": [
      {
        "value": "[وقد مضى في ترجمة أوس بن عبد اللَّه نحو هذا من طريق صخر بن مالك بن إياس بن مالك بن أوس بن عبد اللَّه بن حجر الأسلمي من أهل العرج، أخبره أنّ أباه مالك بن أوس أخبره أنّ أباه أوسا مرّ به، وهو في مغازي موسى بن عقبة، عن ابن شهاب- أن النبيّ صلّى اللَّه تعالى عليه وآله وسلم لما هبط العرج في الهجرة حمله رجل",
        "source": "regex",
        "evidence": "[وقد مضى في ترجمة أوس بن عبد اللَّه نحو هذا من طريق صخر بن مالك بن إياس بن مالك بن أوس بن عبد اللَّه بن حجر الأسلمي من أهل العرج، أخبره أنّ أباه مالك بن أوس أخبره أنّ أباه أوسا مرّ به، وهو في مغازي موسى بن عقبة، عن ابن شهاب- أن النبيّ صلّى اللَّه تعالى عليه وآله وسلم لما هبط العرج في الهجرة حمله رجل من أسلم يقال له مالك بن أوس على جمل يقال له ابن اللقاح، وبعث معه غلاما له يدعى مغيثا، فسلك به.",
        "confidence": 0.3,
        "key": null
      }
    ],
    "traits": []
  },
  "narration": {
    "is_prolific": false,
    "hadith_count": null,
    "narrated_from": [],
    "narrated_to": [],
    "praise": [],
    "criticism": [],
    "defenses": []
  },
  "extraction": {
    "layers": [
      "structural",
      "regex"
    ],
    "llm": null,
    "regex": {
      "version": "regex-bio/2.0.0",
      "extracted_at": "2026-09-17T16:15:07.993Z"
    }
  }
}
